{
  "schema_version": "1.0",
  "assembly_id": "assembly.creature.dragon.d02",
  "subject": {
    "asset_id": "creature.dragon.d02",
    "version": "0.1.0"
  },
  "model": "subjects/fantastical/creature.dragon.d02/0.1.0/model/D02.glb",
  "bindings": {
    "rig": "subjects/fantastical/creature.dragon.d02/0.1.0/bindings/rig.json",
    "animations": "subjects/fantastical/creature.dragon.d02/0.1.0/bindings/animation_map.json",
    "sockets": "subjects/fantastical/creature.dragon.d02/0.1.0/bindings/sockets.json"
  },
  "modules": [
    {
      "asset_id": "module.host.subject",
      "version": "1.0.0"
    }
  ],
  "authority": {
    "root_transform": "host.motor",
    "animation": "host.animation",
    "camera": "host.camera"
  },
  "stage": "assets_ready",
  "runtime_ready": false,
  "facts": {
    "physical": "subjects/fantastical/creature.dragon.d02/0.1.0/facts/physical.json"
  }
}
