{
  "schema_version": "1.0",
  "assembly_id": "assembly.animal.animx-advanced-cats-427",
  "subject": {
    "asset_id": "animal.animx-advanced-cats-427",
    "version": "0.1.0"
  },
  "model": null,
  "bindings": {
    "rig": "subjects/animals/animal.animx-advanced-cats-427/0.1.0/bindings/rig.json",
    "animations": "subjects/animals/animal.animx-advanced-cats-427/0.1.0/bindings/animation_map.json",
    "sockets": "subjects/animals/animal.animx-advanced-cats-427/0.1.0/bindings/sockets.json"
  },
  "modules": [
    {
      "asset_id": "module.host.subject",
      "version": "1.0.0"
    }
  ],
  "authority": {
    "root_transform": "host.motor",
    "animation": "host.animation",
    "camera": "host.camera"
  },
  "stage": "planned",
  "runtime_ready": false,
  "facts": {
    "physical": "subjects/animals/animal.animx-advanced-cats-427/0.1.0/facts/physical.json"
  }
}
